{
 "region": "europe",
 "snapshot": "2026-08-19",
 "code": "lt",
 "name": "Lietuva",
 "name_en": "Lithuania",
 "country": "lt",
 "area_km2": 64833.2,
 "bbox": [
  20.6557167,
  53.8967893,
  26.8355198,
  56.4504213
 ],
 "transcontinental": false,
 "closed_by_edge": false,
 "A": {
  "poles": [
   {
    "rank": 1,
    "lat": 54.441478,
    "lon": 23.537029,
    "dist_m": 3426.0,
    "nearest_way": {
     "id": 1385319417,
     "highway": "track",
     "name": null,
     "ref": null,
     "country": "lt"
    },
    "nearest_place": {
     "name": "Kumečiai",
     "type": "village",
     "dist_m": 3688.6,
     "lat": 54.472361,
     "lon": 23.516414
    },
    "island_km2": null,
    "detail": "detail/lt/A-54.441478_23.537029",
    "warnings": []
   },
   {
    "rank": 2,
    "lat": 54.010639,
    "lon": 24.529369,
    "dist_m": 3406.88,
    "nearest_way": {
     "id": 259109636,
     "highway": "track",
     "name": null,
     "ref": null,
     "country": "lt"
    },
    "nearest_place": {
     "name": "Katra",
     "type": "village",
     "dist_m": 4390.4,
     "lat": 53.99291,
     "lon": 24.58918
    },
    "island_km2": null,
    "detail": "detail/lt/A-54.010639_24.529369",
    "warnings": []
   },
   {
    "rank": 3,
    "lat": 56.282599,
    "lon": 22.641875,
    "dist_m": 2561.87,
    "nearest_way": {
     "id": 821393760,
     "highway": "track",
     "name": null,
     "ref": null,
     "country": "lt"
    },
    "nearest_place": {
     "name": "Ašvėnai",
     "type": "village",
     "dist_m": 4063.6,
     "lat": 56.273865,
     "lon": 22.578179
    },
    "island_km2": null,
    "detail": "detail/lt/A-56.282599_22.641875",
    "warnings": []
   },
   {
    "rank": 4,
    "lat": 55.248552,
    "lon": 21.262059,
    "dist_m": 2147.79,
    "nearest_way": {
     "id": 1242509661,
     "highway": "track",
     "name": null,
     "ref": null,
     "country": "ru"
    },
    "nearest_place": {
     "name": "Мысовка",
     "type": "town",
     "dist_m": 6375.9,
     "lat": 55.191493,
     "lon": 21.270691
    },
    "island_km2": null,
    "detail": "detail/lt/A-55.248552_21.262059",
    "warnings": []
   },
   {
    "rank": 5,
    "lat": 56.215814,
    "lon": 23.228859,
    "dist_m": 2131.59,
    "nearest_way": {
     "id": 971467229,
     "highway": "track",
     "name": null,
     "ref": null,
     "country": "lt"
    },
    "nearest_place": {
     "name": "Juodeikiai",
     "type": "village",
     "dist_m": 2830.4,
     "lat": 56.240646,
     "lon": 23.219101
    },
    "island_km2": null,
    "detail": "detail/lt/A-56.215814_23.228859",
    "warnings": []
   },
   {
    "rank": 6,
    "lat": 55.781048,
    "lon": 25.01457,
    "dist_m": 2081.81,
    "nearest_way": {
     "id": 1359673105,
     "highway": "service",
     "name": null,
     "ref": null,
     "country": "lt"
    },
    "nearest_place": {
     "name": "Šalnakandžiai",
     "type": "village",
     "dist_m": 2185.0,
     "lat": 55.785641,
     "lon": 24.980711
    },
    "island_km2": null,
    "detail": "detail/lt/A-55.781048_25.014570",
    "warnings": []
   },
   {
    "rank": 7,
    "lat": 54.931449,
    "lon": 25.908169,
    "dist_m": 2078.56,
    "nearest_way": {
     "id": 801400210,
     "highway": "track",
     "name": null,
     "ref": null,
     "country": "lt"
    },
    "nearest_place": {
     "name": "Juozapavas",
     "type": "hamlet",
     "dist_m": 2994.5,
     "lat": 54.956086,
     "lon": 25.88941
    },
    "island_km2": null,
    "detail": "detail/lt/A-54.931449_25.908169",
    "warnings": []
   },
   {
    "rank": 8,
    "lat": 55.854864,
    "lon": 23.283978,
    "dist_m": 1956.66,
    "nearest_way": {
     "id": 435682789,
     "highway": "track",
     "name": null,
     "ref": null,
     "country": "lt"
    },
    "nearest_place": {
     "name": "Vaikšnėgala",
     "type": "village",
     "dist_m": 2860.5,
     "lat": 55.832054,
     "lon": 23.262967
    },
    "island_km2": null,
    "detail": "detail/lt/A-55.854864_23.283978",
    "warnings": []
   },
   {
    "rank": 9,
    "lat": 55.512872,
    "lon": 23.453296,
    "dist_m": 1907.88,
    "nearest_way": {
     "id": 1459335438,
     "highway": "track",
     "name": null,
     "ref": null,
     "country": "lt"
    },
    "nearest_place": {
     "name": "Liaubarai",
     "type": "village",
     "dist_m": 1964.5,
     "lat": 55.49815,
     "lon": 23.470434
    },
    "island_km2": null,
    "detail": "detail/lt/A-55.512872_23.453296",
    "warnings": []
   },
   {
    "rank": 10,
    "lat": 55.723794,
    "lon": 23.405312,
    "dist_m": 1853.56,
    "nearest_way": {
     "id": 400174545,
     "highway": "track",
     "name": null,
     "ref": null,
     "country": "lt"
    },
    "nearest_place": {
     "name": "Birietiškiai",
     "type": "village",
     "dist_m": 2398.2,
     "lat": 55.71814,
     "lon": 23.368487
    },
    "island_km2": null,
    "detail": "detail/lt/A-55.723794_23.405312",
    "warnings": []
   }
  ],
  "withheld": 0,
  "reason": null
 },
 "A_mainland": {
  "dist_m": 3426.0,
  "lat": 54.441478,
  "lon": 23.537029,
  "rank": 37,
  "withheld": 0
 },
 "B": {
  "poles": [
   {
    "rank": 1,
    "lat": 53.995841,
    "lon": 24.463029,
    "dist_m": 6675.91,
    "nearest_way": {
     "id": 477277100,
     "highway": "residential",
     "name": "Čepkelių g.",
     "ref": null,
     "country": "lt"
    },
    "nearest_place": {
     "name": "Grybaulia",
     "type": "village",
     "dist_m": 6635.2,
     "lat": 53.999876,
     "lon": 24.362082
    },
    "island_km2": null,
    "detail": "detail/lt/B-53.995841_24.463029",
    "warnings": []
   },
   {
    "rank": 2,
    "lat": 55.128047,
    "lon": 22.4353,
    "dist_m": 4829.66,
    "nearest_way": {
     "id": 397437293,
     "highway": "service",
     "name": null,
     "ref": null,
     "country": "lt"
    },
    "nearest_place": {
     "name": "Leipgiriai",
     "type": "village",
     "dist_m": 2816.5,
     "lat": 55.105548,
     "lon": 22.455487
    },
    "island_km2": null,
    "detail": "detail/lt/B-55.128047_22.435300",
    "warnings": []
   },
   {
    "rank": 3,
    "lat": 54.355505,
    "lon": 25.032999,
    "dist_m": 4688.35,
    "nearest_way": {
     "id": 1498216824,
     "highway": "service",
     "name": null,
     "ref": null,
     "country": "lt"
    },
    "nearest_place": {
     "name": "Visinčia",
     "type": "village",
     "dist_m": 4310.6,
     "lat": 54.330604,
     "lon": 25.083761
    },
    "island_km2": null,
    "detail": "detail/lt/B-54.355505_25.032999",
    "warnings": []
   },
   {
    "rank": 4,
    "lat": 55.205421,
    "lon": 22.571984,
    "dist_m": 3894.05,
    "nearest_way": {
     "id": 447977712,
     "highway": "unclassified",
     "name": null,
     "ref": null,
     "country": "lt"
    },
    "nearest_place": {
     "name": "Globiai",
     "type": "village",
     "dist_m": 2900.7,
     "lat": 55.193555,
     "lon": 22.61254
    },
    "island_km2": null,
    "detail": "detail/lt/B-55.205421_22.571984",
    "warnings": []
   },
   {
    "rank": 5,
    "lat": 54.138315,
    "lon": 24.543308,
    "dist_m": 3886.23,
    "nearest_way": {
     "id": 1295978209,
     "highway": "secondary",
     "name": null,
     "ref": "5014",
     "country": "lt"
    },
    "nearest_place": {
     "name": "Zervynos",
     "type": "village",
     "dist_m": 4312.5,
     "lat": 54.110305,
     "lon": 24.497734
    },
    "island_km2": null,
    "detail": "detail/lt/B-54.138315_24.543308",
    "warnings": []
   },
   {
    "rank": 6,
    "lat": 55.09677,
    "lon": 25.822451,
    "dist_m": 3694.91,
    "nearest_way": {
     "id": 151851249,
     "highway": "unclassified",
     "name": null,
     "ref": null,
     "country": "lt"
    },
    "nearest_place": {
     "name": "Argirdiškė",
     "type": "village",
     "dist_m": 3725.6,
     "lat": 55.12879,
     "lon": 25.839427
    },
    "island_km2": null,
    "detail": "detail/lt/B-55.096770_25.822451",
    "warnings": []
   },
   {
    "rank": 7,
    "lat": 56.24967,
    "lon": 24.983172,
    "dist_m": 3693.13,
    "nearest_way": {
     "id": 1442811636,
     "highway": "service",
     "name": null,
     "ref": null,
     "country": "lt"
    },
    "nearest_place": {
     "name": "Garjoniai",
     "type": "village",
     "dist_m": 3577.2,
     "lat": 56.27326,
     "lon": 25.02236
    },
    "island_km2": null,
    "detail": "detail/lt/B-56.249670_24.983172",
    "warnings": []
   },
   {
    "rank": 8,
    "lat": 54.439818,
    "lon": 23.533801,
    "dist_m": 3595.62,
    "nearest_way": {
     "id": 116167346,
     "highway": "residential",
     "name": null,
     "ref": null,
     "country": "lt"
    },
    "nearest_place": {
     "name": "Kumečiai",
     "type": "village",
     "dist_m": 3794.0,
     "lat": 54.472361,
     "lon": 23.516414
    },
    "island_km2": null,
    "detail": "detail/lt/B-54.439818_23.533801",
    "warnings": []
   },
   {
    "rank": 9,
    "lat": 53.930043,
    "lon": 23.626556,
    "dist_m": 3541.38,
    "nearest_way": {
     "id": 39549433,
     "highway": "tertiary",
     "name": null,
     "ref": "2504",
     "country": "lt"
    },
    "nearest_place": {
     "name": "Pertakas",
     "type": "village",
     "dist_m": 2318.4,
     "lat": 53.950843,
     "lon": 23.628427
    },
    "island_km2": null,
    "detail": "detail/lt/B-53.930043_23.626556",
    "warnings": []
   },
   {
    "rank": 10,
    "lat": 54.026162,
    "lon": 24.241139,
    "dist_m": 3464.42,
    "nearest_way": {
     "id": 127212932,
     "highway": "unclassified",
     "name": null,
     "ref": null,
     "country": "lt"
    },
    "nearest_place": {
     "name": "Kapiniškiai",
     "type": "village",
     "dist_m": 3570.7,
     "lat": 54.013106,
     "lon": 24.290901
    },
    "island_km2": null,
    "detail": "detail/lt/B-54.026162_24.241139",
    "warnings": []
   }
  ],
  "withheld": 0,
  "reason": null
 },
 "B_mainland": {
  "dist_m": 6675.91,
  "lat": 53.995841,
  "lon": 24.463029,
  "rank": 30,
  "withheld": 0
 }
}
