{
 "region": "europe",
 "snapshot": "2026-08-19",
 "code": "ad",
 "name": "Andorra",
 "name_en": "Andorra",
 "country": "ad",
 "area_km2": 487.9,
 "bbox": [
  1.4077997,
  42.4288238,
  1.7868662,
  42.6559357
 ],
 "transcontinental": false,
 "closed_by_edge": false,
 "A": {
  "poles": [
   {
    "rank": 1,
    "lat": 42.48936,
    "lon": 1.642551,
    "dist_m": 4963.65,
    "nearest_way": {
     "id": 324990517,
     "highway": "track",
     "name": null,
     "ref": null,
     "country": "ad"
    },
    "nearest_place": {
     "name": "Bordes de Rigoder",
     "type": "isolated_dwelling",
     "dist_m": 5808.8,
     "lat": 42.537897,
     "lon": 1.616247
    },
    "island_km2": null,
    "detail": "detail/ad/A-42.489360_1.642551",
    "warnings": []
   },
   {
    "rank": 2,
    "lat": 42.617788,
    "lon": 1.736044,
    "dist_m": 3617.7,
    "nearest_way": {
     "id": 208567272,
     "highway": "track",
     "name": "Camí de la Font del Trabenc",
     "ref": null,
     "country": "ad"
    },
    "nearest_place": {
     "name": "L'Hospitalet-près-l'Andorre",
     "type": "village",
     "dist_m": 6078.9,
     "lat": 42.587865,
     "lon": 1.798064
    },
    "island_km2": null,
    "detail": "detail/ad/A-42.617788_1.736044",
    "warnings": []
   },
   {
    "rank": 3,
    "lat": 42.597759,
    "lon": 1.495577,
    "dist_m": 2341.96,
    "nearest_way": {
     "id": 371470856,
     "highway": "track",
     "name": null,
     "ref": null,
     "country": "ad"
    },
    "nearest_place": {
     "name": "Arans",
     "type": "village",
     "dist_m": 2504.0,
     "lat": 42.582531,
     "lon": 1.518069
    },
    "island_km2": null,
    "detail": "detail/ad/A-42.597759_1.495577",
    "warnings": []
   },
   {
    "rank": 4,
    "lat": 42.501749,
    "lon": 1.475451,
    "dist_m": 1777.74,
    "nearest_way": {
     "id": 1070665487,
     "highway": "track",
     "name": null,
     "ref": null,
     "country": "ad"
    },
    "nearest_place": {
     "name": "la Margineda",
     "type": "village",
     "dist_m": 2097.3,
     "lat": 42.48701,
     "lon": 1.491396
    },
    "island_km2": null,
    "detail": "detail/ad/A-42.501749_1.475451",
    "warnings": []
   }
  ],
  "withheld": 0,
  "reason": "only 4 mainland pole(s): no further point of the unit is a distinct area, at least 10 km from the accepted poles and on allowed ground"
 },
 "A_mainland": {
  "dist_m": 4963.65,
  "lat": 42.48936,
  "lon": 1.642551,
  "rank": 22,
  "withheld": 0
 },
 "B": {
  "poles": [
   {
    "rank": 1,
    "lat": 42.48471,
    "lon": 1.660912,
    "dist_m": 5985.45,
    "nearest_way": {
     "id": 744476594,
     "highway": "service",
     "name": "Carretera del Cap de Rec",
     "ref": null,
     "country": "es"
    },
    "nearest_place": {
     "name": "Cal Jan de la Llosa",
     "type": "isolated_dwelling",
     "dist_m": 5953.6,
     "lat": 42.439595,
     "lon": 1.69999
    },
    "island_km2": null,
    "detail": "detail/ad/B-42.484710_1.660912",
    "warnings": []
   },
   {
    "rank": 2,
    "lat": 42.617788,
    "lon": 1.736044,
    "dist_m": 4377.64,
    "nearest_way": {
     "id": 203263493,
     "highway": "tertiary",
     "name": "Carretera de la Vall d'Incles",
     "ref": "CS-270",
     "country": "ad"
    },
    "nearest_place": {
     "name": "L'Hospitalet-près-l'Andorre",
     "type": "village",
     "dist_m": 6078.9,
     "lat": 42.587865,
     "lon": 1.798064
    },
    "island_km2": null,
    "detail": "detail/ad/B-42.617788_1.736044",
    "warnings": []
   },
   {
    "rank": 3,
    "lat": 42.467098,
    "lon": 1.466865,
    "dist_m": 1199.73,
    "nearest_way": {
     "id": 547233362,
     "highway": "primary",
     "name": null,
     "ref": "CG-6",
     "country": "ad"
    },
    "nearest_place": {
     "name": "Fontaneda",
     "type": "village",
     "dist_m": 1439.7,
     "lat": 42.454309,
     "lon": 1.464024
    },
    "island_km2": null,
    "detail": "detail/ad/B-42.467098_1.466865",
    "warnings": []
   },
   {
    "rank": 4,
    "lat": 42.542804,
    "lon": 1.559912,
    "dist_m": 1030.87,
    "nearest_way": {
     "id": 23924998,
     "highway": "secondary",
     "name": null,
     "ref": "CS-340",
     "country": "ad"
    },
    "nearest_place": {
     "name": "Vila",
     "type": "village",
     "dist_m": 1335.6,
     "lat": 42.531854,
     "lon": 1.566625
    },
    "island_km2": null,
    "detail": "detail/ad/B-42.542804_1.559912",
    "warnings": []
   },
   {
    "rank": 5,
    "lat": 42.631089,
    "lon": 1.493444,
    "dist_m": 172.82,
    "nearest_way": {
     "id": 206377994,
     "highway": "primary",
     "name": "Carretera General 3",
     "ref": "CG-3",
     "country": "ad"
    },
    "nearest_place": {
     "name": "El Serrat",
     "type": "village",
     "dist_m": 3941.9,
     "lat": 42.619578,
     "lon": 1.538898
    },
    "island_km2": null,
    "detail": "detail/ad/B-42.631089_1.493444",
    "warnings": []
   }
  ],
  "withheld": 0,
  "reason": "only 5 mainland pole(s): no further point of the unit is a distinct area, at least 10 km from the accepted poles and on allowed ground"
 },
 "B_mainland": {
  "dist_m": 5985.45,
  "lat": 42.48471,
  "lon": 1.660912,
  "rank": 34,
  "withheld": 0
 }
}
