{
 "region": "europe",
 "snapshot": "2026-08-19",
 "code": "je",
 "name": "Jersey",
 "name_en": "Jersey",
 "country": "je",
 "area_km2": 142.9,
 "bbox": [
  -2.5605483,
  48.871203,
  -1.8347,
  49.4596091
 ],
 "transcontinental": false,
 "closed_by_edge": false,
 "A": {
  "poles": [
   {
    "rank": 1,
    "lat": 49.169348,
    "lon": -2.189496,
    "dist_m": 815.58,
    "nearest_way": {
     "id": 179412072,
     "highway": "track",
     "name": null,
     "ref": null,
     "country": "je"
    },
    "nearest_place": {
     "name": "Portelet",
     "type": "hamlet",
     "dist_m": 972.9,
     "lat": 49.171999,
     "lon": -2.176782
    },
    "island_km2": null,
    "detail": "detail/je/A-49.169348_-2.189496",
    "warnings": []
   },
   {
    "rank": 2,
    "lat": 49.222186,
    "lon": -2.010437,
    "dist_m": 619.28,
    "nearest_way": {
     "id": 170333854,
     "highway": "service",
     "name": "Verlcut Slipway",
     "ref": null,
     "country": "je"
    },
    "nearest_place": {
     "name": "Gorey",
     "type": "village",
     "dist_m": 3027.1,
     "lat": 49.198828,
     "lon": -2.031765
    },
    "island_km2": null,
    "detail": "detail/je/A-49.222186_-2.010437",
    "warnings": []
   },
   {
    "rank": 3,
    "lat": 49.249494,
    "lon": -2.254498,
    "dist_m": 487.83,
    "nearest_way": {
     "id": 227363314,
     "highway": "track",
     "name": null,
     "ref": null,
     "country": "je"
    },
    "nearest_place": {
     "name": "Les Landes",
     "type": "hamlet",
     "dist_m": 531.0,
     "lat": 49.247256,
     "lon": -2.248054
    },
    "island_km2": null,
    "detail": "detail/je/A-49.249494_-2.254498",
    "warnings": []
   }
  ],
  "withheld": 0,
  "reason": "only 3 mainland pole(s): no further point of the unit is a distinct area, at least 10 km from the accepted poles and on allowed ground"
 },
 "A_mainland": {
  "dist_m": 815.58,
  "lat": 49.169348,
  "lon": -2.189496,
  "rank": 46,
  "withheld": 0
 },
 "B": {
  "poles": [
   {
    "rank": 1,
    "lat": 49.169348,
    "lon": -2.189496,
    "dist_m": 820.95,
    "nearest_way": {
     "id": 167171209,
     "highway": "service",
     "name": "Portelet Bay and Apts",
     "ref": null,
     "country": "je"
    },
    "nearest_place": {
     "name": "Portelet",
     "type": "hamlet",
     "dist_m": 972.9,
     "lat": 49.171999,
     "lon": -2.176782
    },
    "island_km2": null,
    "detail": "detail/je/B-49.169348_-2.189496",
    "warnings": []
   },
   {
    "rank": 2,
    "lat": 49.252592,
    "lon": -2.253623,
    "dist_m": 687.85,
    "nearest_way": {
     "id": 178448635,
     "highway": "service",
     "name": null,
     "ref": null,
     "country": "je"
    },
    "nearest_place": {
     "name": "Les Landes",
     "type": "hamlet",
     "dist_m": 718.7,
     "lat": 49.247256,
     "lon": -2.248054
    },
    "island_km2": null,
    "detail": "detail/je/B-49.252592_-2.253623",
    "warnings": []
   },
   {
    "rank": 3,
    "lat": 49.222186,
    "lon": -2.010437,
    "dist_m": 619.28,
    "nearest_way": {
     "id": 170333854,
     "highway": "service",
     "name": "Verlcut Slipway",
     "ref": null,
     "country": "je"
    },
    "nearest_place": {
     "name": "Gorey",
     "type": "village",
     "dist_m": 3027.1,
     "lat": 49.198828,
     "lon": -2.031765
    },
    "island_km2": null,
    "detail": "detail/je/B-49.222186_-2.010437",
    "warnings": []
   }
  ],
  "withheld": 0,
  "reason": "only 3 mainland pole(s): no further point of the unit is a distinct area, at least 10 km from the accepted poles and on allowed ground"
 },
 "B_mainland": {
  "dist_m": 820.95,
  "lat": 49.169348,
  "lon": -2.189496,
  "rank": 47,
  "withheld": 0
 }
}
