{
 "region": "europe",
 "snapshot": "2026-08-19",
 "code": "gg",
 "name": "Guernsey",
 "name_en": "Guernsey",
 "country": "gg",
 "area_km2": 105.6,
 "bbox": [
  -3.0209018,
  49.219875,
  -2.0502773,
  49.9403001
 ],
 "transcontinental": false,
 "closed_by_edge": false,
 "A": {
  "poles": [
   {
    "rank": 1,
    "lat": 49.695871,
    "lon": -2.235614,
    "dist_m": 1302.34,
    "nearest_way": {
     "id": 180047729,
     "highway": "track",
     "name": null,
     "ref": null,
     "country": "gg"
    },
    "nearest_place": {
     "name": "Saint Anne",
     "type": "town",
     "dist_m": 3007.1,
     "lat": 49.714378,
     "lon": -2.205223
    },
    "island_km2": 8.3,
    "detail": "detail/gg/A-49.695871_-2.235614",
    "warnings": []
   },
   {
    "rank": 2,
    "lat": 49.483118,
    "lon": -2.472849,
    "dist_m": 1280.77,
    "nearest_way": {
     "id": 196968039,
     "highway": "track",
     "name": null,
     "ref": null,
     "country": "gg"
    },
    "nearest_place": {
     "name": "Manor Village",
     "type": "hamlet",
     "dist_m": 2153.5,
     "lat": 49.471789,
     "lon": -2.448751
    },
    "island_km2": 1.3,
    "detail": "detail/gg/A-49.483118_-2.472849",
    "warnings": []
   },
   {
    "rank": 3,
    "lat": 49.404087,
    "lon": -2.381754,
    "dist_m": 1043.51,
    "nearest_way": {
     "id": 1441827558,
     "highway": "service",
     "name": null,
     "ref": null,
     "country": "gg"
    },
    "nearest_place": {
     "name": "Sark",
     "type": "village",
     "dist_m": 3811.9,
     "lat": 49.435165,
     "lon": -2.359599
    },
    "island_km2": 5.8,
    "detail": "detail/gg/A-49.404087_-2.381754",
    "warnings": []
   },
   {
    "rank": 4,
    "lat": 49.461425,
    "lon": -2.676106,
    "dist_m": 773.85,
    "nearest_way": {
     "id": 126881734,
     "highway": "track",
     "name": null,
     "ref": null,
     "country": "gg"
    },
    "nearest_place": {
     "name": "Torteval",
     "type": "hamlet",
     "dist_m": 3863.4,
     "lat": 49.430281,
     "lon": -2.652507
    },
    "island_km2": null,
    "detail": "detail/gg/A-49.461425_-2.676106",
    "warnings": []
   }
  ],
  "withheld": 0,
  "reason": "only 1 mainland pole(s): no further point of the unit is a distinct area, at least 10 km from the accepted poles and on allowed ground"
 },
 "A_mainland": {
  "dist_m": 773.85,
  "lat": 49.461425,
  "lon": -2.676106,
  "rank": 47,
  "withheld": 0
 },
 "B": {
  "poles": [
   {
    "rank": 1,
    "lat": 49.482885,
    "lon": -2.448099,
    "dist_m": 2541.4,
    "nearest_way": {
     "id": 185848724,
     "highway": "service",
     "name": null,
     "ref": null,
     "country": "gg"
    },
    "nearest_place": {
     "name": "Manor Village",
     "type": "hamlet",
     "dist_m": 1235.0,
     "lat": 49.471789,
     "lon": -2.448751
    },
    "island_km2": 1.3,
    "detail": "detail/gg/B-49.482885_-2.448099",
    "warnings": []
   },
   {
    "rank": 2,
    "lat": 49.695871,
    "lon": -2.235614,
    "dist_m": 1558.61,
    "nearest_way": {
     "id": 29385585,
     "highway": "unclassified",
     "name": null,
     "ref": null,
     "country": "gg"
    },
    "nearest_place": {
     "name": "Saint Anne",
     "type": "town",
     "dist_m": 3007.1,
     "lat": 49.714378,
     "lon": -2.205223
    },
    "island_km2": 8.3,
    "detail": "detail/gg/B-49.695871_-2.235614",
    "warnings": []
   },
   {
    "rank": 3,
    "lat": 49.461425,
    "lon": -2.676106,
    "dist_m": 1410.52,
    "nearest_way": {
     "id": 186002404,
     "highway": "service",
     "name": null,
     "ref": null,
     "country": "gg"
    },
    "nearest_place": {
     "name": "Torteval",
     "type": "hamlet",
     "dist_m": 3863.4,
     "lat": 49.430281,
     "lon": -2.652507
    },
    "island_km2": null,
    "detail": "detail/gg/B-49.461425_-2.676106",
    "warnings": []
   },
   {
    "rank": 4,
    "lat": 49.413712,
    "lon": -2.358038,
    "dist_m": 901.19,
    "nearest_way": {
     "id": 1446756639,
     "highway": "service",
     "name": null,
     "ref": null,
     "country": "gg"
    },
    "nearest_place": {
     "name": "Sark",
     "type": "village",
     "dist_m": 2388.6,
     "lat": 49.435165,
     "lon": -2.359599
    },
    "island_km2": 5.8,
    "detail": "detail/gg/B-49.413712_-2.358038",
    "warnings": []
   }
  ],
  "withheld": 0,
  "reason": "only 1 mainland pole(s): no further point of the unit is a distinct area, at least 10 km from the accepted poles and on allowed ground"
 },
 "B_mainland": {
  "dist_m": 1410.52,
  "lat": 49.461425,
  "lon": -2.676106,
  "rank": 47,
  "withheld": 0
 }
}
