{
 "region": "europe",
 "snapshot": "2026-08-19",
 "code": "mt",
 "name": "Malta",
 "name_en": "Malta",
 "country": "mt",
 "area_km2": 347.2,
 "bbox": [
  13.9360446,
  35.5853691,
  14.822786,
  36.2825455
 ],
 "transcontinental": false,
 "closed_by_edge": false,
 "A": {
  "poles": [
   {
    "rank": 1,
    "lat": 35.966768,
    "lon": 14.407674,
    "dist_m": 1049.39,
    "nearest_way": {
     "id": 123727816,
     "highway": "track",
     "name": null,
     "ref": null,
     "country": "mt"
    },
    "nearest_place": {
     "name": "Qawra",
     "type": "village",
     "dist_m": 1779.0,
     "lat": 35.954129,
     "lon": 14.419808
    },
    "island_km2": null,
    "detail": "detail/mt/A-35.966768_14.407674",
    "warnings": []
   },
   {
    "rank": 2,
    "lat": 35.821608,
    "lon": 14.444415,
    "dist_m": 573.52,
    "nearest_way": {
     "id": 386421921,
     "highway": "secondary",
     "name": "Triq il-Panorama",
     "ref": "117",
     "country": "mt"
    },
    "nearest_place": {
     "name": "Wied iż-Żurrieq",
     "type": "hamlet",
     "dist_m": 804.4,
     "lat": 35.819672,
     "lon": 14.452994
    },
    "island_km2": null,
    "detail": "detail/mt/A-35.821608_14.444415",
    "warnings": []
   },
   {
    "rank": 3,
    "lat": 36.058218,
    "lon": 14.311113,
    "dist_m": 534.63,
    "nearest_way": {
     "id": 136640811,
     "highway": "track",
     "name": null,
     "ref": null,
     "country": "mt"
    },
    "nearest_place": {
     "name": "Daħlet Qorrot",
     "type": "hamlet",
     "dist_m": 1159.0,
     "lat": 36.048784,
     "lon": 14.316634
    },
    "island_km2": 66.0,
    "detail": "detail/mt/A-36.058218_14.311113",
    "warnings": []
   },
   {
    "rank": 4,
    "lat": 36.046912,
    "lon": 14.188155,
    "dist_m": 418.91,
    "nearest_way": {
     "id": 968605955,
     "highway": "service",
     "name": null,
     "ref": null,
     "country": "mt"
    },
    "nearest_place": {
     "name": "Saint Lawrence",
     "type": "village",
     "dist_m": 1700.6,
     "lat": 36.055301,
     "lon": 14.20395
    },
    "island_km2": 66.0,
    "detail": "detail/mt/A-36.046912_14.188155",
    "warnings": []
   },
   {
    "rank": 5,
    "lat": 35.900417,
    "lon": 14.330501,
    "dist_m": 339.08,
    "nearest_way": {
     "id": 1422132631,
     "highway": "track",
     "name": null,
     "ref": null,
     "country": "mt"
    },
    "nearest_place": {
     "name": "Baħrija",
     "type": "village",
     "dist_m": 1718.2,
     "lat": 35.894711,
     "lon": 14.348194
    },
    "island_km2": null,
    "detail": "detail/mt/A-35.900417_14.330501",
    "warnings": []
   },
   {
    "rank": 6,
    "lat": 35.849632,
    "lon": 14.572185,
    "dist_m": 314.56,
    "nearest_way": {
     "id": 152024843,
     "highway": "track",
     "name": null,
     "ref": null,
     "country": "mt"
    },
    "nearest_place": {
     "name": "Marsascala",
     "type": "town",
     "dist_m": 1884.4,
     "lat": 35.862916,
     "lon": 14.559188
    },
    "island_km2": null,
    "detail": "detail/mt/A-35.849632_14.572185",
    "warnings": []
   }
  ],
  "withheld": 0,
  "reason": "only 4 mainland pole(s): no further point of the unit is a distinct area, at least 10 km from the accepted poles and on allowed ground"
 },
 "A_mainland": {
  "dist_m": 1049.39,
  "lat": 35.966768,
  "lon": 14.407674,
  "rank": 45,
  "withheld": 0
 },
 "B": {
  "poles": [
   {
    "rank": 1,
    "lat": 35.967414,
    "lon": 14.407492,
    "dist_m": 1477.36,
    "nearest_way": {
     "id": 25378945,
     "highway": "tertiary",
     "name": "Triq il-Mistra",
     "ref": null,
     "country": "mt"
    },
    "nearest_place": {
     "name": "Qawra",
     "type": "village",
     "dist_m": 1845.9,
     "lat": 35.954129,
     "lon": 14.419808
    },
    "island_km2": null,
    "detail": "detail/mt/B-35.967414_14.407492",
    "warnings": []
   },
   {
    "rank": 2,
    "lat": 36.074139,
    "lon": 14.184748,
    "dist_m": 927.38,
    "nearest_way": {
     "id": 15937641,
     "highway": "unclassified",
     "name": "Triq Neigu",
     "ref": null,
     "country": "mt"
    },
    "nearest_place": {
     "name": "Għarb",
     "type": "village",
     "dist_m": 2707.5,
     "lat": 36.059818,
     "lon": 14.209081
    },
    "island_km2": 66.0,
    "detail": "detail/mt/B-36.074139_14.184748",
    "warnings": []
   },
   {
    "rank": 3,
    "lat": 35.897643,
    "lon": 14.32904,
    "dist_m": 766.12,
    "nearest_way": {
     "id": 441709215,
     "highway": "secondary",
     "name": "Fomm ir-Riħ, Limiti tar-Rabat",
     "ref": "125",
     "country": "mt"
    },
    "nearest_place": {
     "name": "Baħrija",
     "type": "village",
     "dist_m": 1759.6,
     "lat": 35.894711,
     "lon": 14.348194
    },
    "island_km2": null,
    "detail": "detail/mt/B-35.897643_14.329040",
    "warnings": []
   },
   {
    "rank": 4,
    "lat": 36.046499,
    "lon": 14.323827,
    "dist_m": 671.62,
    "nearest_way": {
     "id": 222088167,
     "highway": "service",
     "name": null,
     "ref": null,
     "country": "mt"
    },
    "nearest_place": {
     "name": "Daħlet Qorrot",
     "type": "hamlet",
     "dist_m": 696.0,
     "lat": 36.048784,
     "lon": 14.316634
    },
    "island_km2": 66.0,
    "detail": "detail/mt/B-36.046499_14.323827",
    "warnings": []
   },
   {
    "rank": 5,
    "lat": 35.849729,
    "lon": 14.572197,
    "dist_m": 660.94,
    "nearest_way": {
     "id": 32854581,
     "highway": "unclassified",
     "name": "Xatt il-Batterija ta' Riħama",
     "ref": null,
     "country": "mt"
    },
    "nearest_place": {
     "name": "Marsascala",
     "type": "town",
     "dist_m": 1876.6,
     "lat": 35.862916,
     "lon": 14.559188
    },
    "island_km2": null,
    "detail": "detail/mt/B-35.849729_14.572197",
    "warnings": []
   },
   {
    "rank": 6,
    "lat": 35.822453,
    "lon": 14.438217,
    "dist_m": 638.66,
    "nearest_way": {
     "id": 263080420,
     "highway": "service",
     "name": null,
     "ref": null,
     "country": "mt"
    },
    "nearest_place": {
     "name": "Wied iż-Żurrieq",
     "type": "hamlet",
     "dist_m": 1370.5,
     "lat": 35.819672,
     "lon": 14.452994
    },
    "island_km2": null,
    "detail": "detail/mt/B-35.822453_14.438217",
    "warnings": []
   }
  ],
  "withheld": 0,
  "reason": "only 4 mainland pole(s): no further point of the unit is a distinct area, at least 10 km from the accepted poles and on allowed ground"
 },
 "B_mainland": {
  "dist_m": 1477.36,
  "lat": 35.967414,
  "lon": 14.407492,
  "rank": 46,
  "withheld": 0
 }
}
